{
  "schema_version": 2,
  "receipt_type": "system_governance_bootstrap_v2",
  "trust_mode": "local_controlled_same_user",
  "security_caveat": "same_os_user_can_access_private_key_not_host_native_attestation",
  "explicit_user_authorization": true,
  "authorization_source": "{{EXTERNAL_USER_AUTHORIZATION_ID}}",
  "issuer": "{{EXTERNAL_LOCAL_SIGNER_ID}}",
  "key_id": "{{EXTERNAL_KEY_ID}}",
  "key_fingerprint_sha256": "{{PINNED_RAW_ED25519_PUBLIC_KEY_SHA256}}",
  "agent_handle": "{{ASSIGNED_AGENT_HANDLE}}",
  "assigned_model": "gpt-5.6-sol",
  "assigned_reasoning_effort": "medium",
  "role": "implementation",
  "project_root": "{{ABSOLUTE_PROJECT_ROOT}}",
  "replay_state_path": "{{EXACT_CANONICAL_ABSOLUTE_REPLAY_STATE_PATH}}",
  "module_registration": {"module_key": "M11", "stable_title": "{{STABLE_M11_TITLE}}", "owned_paths": ["{{CANONICAL_PROJECT_RELATIVE_OWNED_PATH}}"]},
  "governance_targets": [
    {"path": "AGENTS.md", "pre_sha256": "{{PRE_AGENTS_SHA256}}", "pre_size": 1, "post_sha256": "{{POST_AGENTS_SHA256}}", "post_size": 1},
    {"path": "docs/agents/module-agent-governance.md", "pre_sha256": "{{PRE_GOVERNANCE_SHA256}}", "pre_size": 1, "post_sha256": "{{POST_GOVERNANCE_SHA256}}", "post_size": 1}
  ],
  "issued_at": "{{UTC_ISSUED_AT}}",
  "not_before": "{{UTC_NOT_BEFORE}}",
  "expires_at": "{{UTC_EXPIRES_AT}}",
  "nonce": "{{UNIQUE_SHA256_NONCE}}",
  "receipt_id": "{{UNIQUE_RECEIPT_ID}}",
  "operation_id": "{{UNIQUE_BOOTSTRAP_OPERATION_ID}}",
  "one_time": true,
  "baseline_sha256": "{{BASELINE_SHA256}}",
  "pre_policy_sha256": "{{PRE_POLICY_SHA256}}",
  "post_policy_sha256": "{{POST_POLICY_SHA256}}",
  "pre_authority_matrix_sha256": "{{PRE_AUTHORITY_MATRIX_SHA256}}",
  "post_authority_matrix_sha256": "{{POST_AUTHORITY_MATRIX_SHA256}}",
  "bootstrap_candidate_sha256": "{{BOOTSTRAP_CANDIDATE_SHA256}}",
  "next_authority": "local-controlled-module-write-lease-required"
}
